{
  "schemaVersion": 1,
  "lessonId": "M01-L003",
  "sourceScript": "script-master.json",
  "scenes": [
    {
      "id": "scene-1",
      "seconds": 45,
      "voiceover": [
        "Use สวัสดี sà-wàt-dii to open politely."
      ],
      "overlays": [
        "Greeting",
        "สวัสดี | sà-wàt-dii | hello"
      ],
      "thaiFocus": [
        {
          "thai": "สวัสดี",
          "translit": "sà-wàt-dii",
          "english": "hello"
        }
      ],
      "assets": [
        {
          "assetId": "m01-l003-scene-1-asset-1",
          "kind": "image",
          "query": "Fallback Thai Lesson Greeting thai learning visual",
          "sourcePolicy": "internet-first",
          "sourceUrl": "https://www.pexels.com/search/Fallback%20Thai%20Lesson%20Greeting/",
          "license": "Pexels License"
        }
      ]
    },
    {
      "id": "scene-2",
      "seconds": 45,
      "voiceover": [
        "Use ขอบคุณ khàawp-khun to close politely."
      ],
      "overlays": [
        "Thanks",
        "ขอบคุณ | khàawp-khun | thank you"
      ],
      "thaiFocus": [
        {
          "thai": "ขอบคุณ",
          "translit": "khàawp-khun",
          "english": "thank you"
        },
        {
          "thai": "ขอโทษ",
          "translit": "khǎaw-thôot",
          "english": "excuse me / sorry"
        }
      ],
      "assets": [
        {
          "assetId": "m01-l003-scene-2-asset-1",
          "kind": "image",
          "query": "Fallback Thai Lesson Thanks thai learning visual",
          "sourcePolicy": "internet-first",
          "sourceUrl": "https://www.pexels.com/search/Fallback%20Thai%20Lesson%20Thanks/",
          "license": "Pexels License"
        }
      ]
    },
    {
      "id": "scene-3",
      "seconds": 45,
      "voiceover": [
        "Use ไม่เข้าใจ mâi khâo-jai when needed.",
        "Add พูดช้าๆ ได้ไหม phûut cháa-cháa dâai mái to control conversation speed."
      ],
      "overlays": [
        "Repair",
        "ไม่เข้าใจ | mâi khâo-jai | I do not understand",
        "พูดช้าๆ ได้ไหม | phûut cháa-cháa dâai mái | can you speak slowly?"
      ],
      "thaiFocus": [
        {
          "thai": "ไม่เข้าใจ",
          "translit": "mâi khâo-jai",
          "english": "I do not understand"
        },
        {
          "thai": "พูดช้าๆ ได้ไหม",
          "translit": "phûut cháa-cháa dâai mái",
          "english": "can you speak slowly?"
        }
      ],
      "assets": [
        {
          "assetId": "m01-l003-scene-3-asset-1",
          "kind": "image",
          "query": "Fallback Thai Lesson Repair thai learning visual",
          "sourcePolicy": "internet-first",
          "sourceUrl": "https://www.pexels.com/search/Fallback%20Thai%20Lesson%20Repair/",
          "license": "Pexels License"
        }
      ]
    }
  ]
}
